{
  "schemaVersion": 1,
  "generatedAt": "2026-07-20T18:00:00Z",
  "recommendationsGeneratedAt": "2026-07-20T17:45:00Z",
  "watched": [
    {
      "tmdbId": 329865,
      "title": "Arrival",
      "originalTitle": "Arrival",
      "year": 2016,
      "releaseDate": "2016-11-10",
      "posterUrl": "/x2FJsf1ElAgr63Y3PNPtJrcmpoe.jpg",
      "overview": "A linguist works to understand visitors whose arrival may reshape humanity's future.",
      "genres": ["Drama", "Science Fiction", "Mystery"],
      "voteAverage": 7.6,
      "popularity": 84.2,
      "rating": 9,
      "watchedAt": "2026-07-12",
      "tags": ["first contact", "language", "thoughtful"],
      "review": "A rare science-fiction film where attention and empathy matter more than spectacle. Its structure rewards patience, and the final movement gives every earlier scene a different emotional weight.",
      "sourceUrl": null
    },
    {
      "tmdbId": 376867,
      "title": "Moonlight",
      "originalTitle": "Moonlight",
      "year": 2016,
      "releaseDate": "2016-10-21",
      "posterUrl": "/qAwFbszz0kRyTuXmMeKQZCX3Q2O.jpg",
      "overview": "A young man searches for identity and connection across three chapters of his life.",
      "genres": ["Drama"],
      "voteAverage": 7.4,
      "popularity": 42.1,
      "rating": 9.5,
      "watchedAt": "2026-06-28",
      "tags": ["intimate", "coming of age", "visual"],
      "review": "Quiet, precise, and deeply humane. The performances feel connected across time, while the color and music express what the characters cannot say aloud.",
      "sourceUrl": null
    },
    {
      "tmdbId": 120467,
      "title": "The Grand Budapest Hotel",
      "originalTitle": "The Grand Budapest Hotel",
      "year": 2014,
      "releaseDate": "2014-02-26",
      "posterUrl": "/eWdyYQreja6JGCzqHWXpWHDrrPo.jpg",
      "overview": "A concierge and his lobby-boy protégé become entangled in a vanished painting and a family fortune.",
      "genres": ["Comedy", "Drama", "Adventure"],
      "voteAverage": 8.0,
      "popularity": 61.8,
      "rating": 8.5,
      "watchedAt": "2026-06-03",
      "tags": ["stylized", "melancholy", "ensemble"],
      "review": "The meticulous comedy is irresistible, but the fading world underneath it is what stays. Every visual joke also seems to preserve something already disappearing.",
      "sourceUrl": null
    }
  ],
  "watchlist": [
    {
      "tmdbId": 976893,
      "title": "Perfect Days",
      "originalTitle": "PERFECT DAYS",
      "year": 2023,
      "releaseDate": "2023-11-10",
      "posterUrl": "/mjEk5Wwx6TYVqw29zSaUHclMIgp.jpg",
      "overview": "A Tokyo cleaner finds meaning through routine, music, books, and brief encounters.",
      "genres": ["Drama"],
      "voteAverage": 7.8,
      "popularity": 37.4,
      "interest": 9.5,
      "notes": "Seems ideal for a quiet Sunday evening.",
      "tags": ["contemplative", "Tokyo"],
      "dismissed": false
    },
    {
      "tmdbId": 915935,
      "title": "Anatomy of a Fall",
      "originalTitle": "Anatomie d'une chute",
      "year": 2023,
      "releaseDate": "2023-08-23",
      "posterUrl": "/kQs6keheMwCxJxrzV83VUwFtHkB.jpg",
      "overview": "A writer faces trial after her husband's suspicious death exposes the uncertainty inside their marriage.",
      "genres": ["Drama", "Mystery", "Crime"],
      "voteAverage": 7.5,
      "popularity": 45.7,
      "interest": 9,
      "notes": "Recommended for its ambiguity and performances.",
      "tags": ["courtroom", "psychological"],
      "dismissed": false
    },
    {
      "tmdbId": 965150,
      "title": "Aftersun",
      "originalTitle": "Aftersun",
      "year": 2022,
      "releaseDate": "2022-10-21",
      "posterUrl": "/jeXmhP2zbUkREMRqFOYIwQOk49T.jpg",
      "overview": "Years later, a woman revisits memories of a holiday with her father.",
      "genres": ["Drama"],
      "voteAverage": 7.7,
      "popularity": 33.1,
      "interest": 8.5,
      "notes": "Save for when I want something emotionally demanding.",
      "tags": ["memory", "family"],
      "dismissed": false
    }
  ],
  "deterministicDiscoveries": [
    {
      "tmdbId": 414453,
      "title": "Columbus",
      "originalTitle": "Columbus",
      "year": 2017,
      "releaseDate": "2017-08-04",
      "posterUrl": "/94tzW9KlzE8TkL7HotcKf9p0iKr.jpg",
      "overview": "Two people form a friendship through architecture, responsibility, and suspended plans.",
      "genres": ["Drama"],
      "voteAverage": 7.1,
      "popularity": 16.4,
      "predictedRating": 8.5,
      "rationale": "Your highest ratings favor intimate dramas with precise visual language and patient observation.",
      "source": "deterministic",
      "generatedAt": "2026-07-20T17:45:00Z",
      "provider": null,
      "model": null
    },
    {
      "tmdbId": 660120,
      "title": "The Worst Person in the World",
      "originalTitle": "Verdens verste menneske",
      "year": 2021,
      "releaseDate": "2021-10-13",
      "posterUrl": "/p5nLFV9aa0Zq1z3gTQ8hwPFUfh6.jpg",
      "overview": "A young woman navigates love, work, and the uncertainty of becoming herself.",
      "genres": ["Drama", "Romance", "Comedy"],
      "voteAverage": 7.5,
      "popularity": 25.8,
      "predictedRating": 8.5,
      "rationale": "It matches your preference for character studies that balance melancholy with sharply observed humor.",
      "source": "deterministic",
      "generatedAt": "2026-07-20T17:45:00Z",
      "provider": null,
      "model": null
    }
  ],
  "aiDiscoveries": [
    {
      "tmdbId": 795514,
      "title": "Petite Maman",
      "originalTitle": "Petite maman",
      "year": 2021,
      "releaseDate": "2021-06-02",
      "posterUrl": "/e3lx2GQPAWcwa1O9rE9F8l4mMqm.jpg",
      "overview": "A child exploring her mother's childhood home meets a girl building a treehouse nearby.",
      "genres": ["Drama", "Fantasy"],
      "voteAverage": 7.1,
      "popularity": 18.9,
      "predictedRating": 9,
      "rationale": "Its compact story uses a quiet speculative idea to explore memory and family, echoing what you valued in Arrival and Moonlight.",
      "source": "ai",
      "generatedAt": "2026-07-20T17:45:00Z",
      "provider": "openai-compatible",
      "model": "demo-model"
    },
    {
      "tmdbId": 582,
      "title": "The Lives of Others",
      "originalTitle": "Das Leben der Anderen",
      "year": 2006,
      "releaseDate": "2006-03-23",
      "posterUrl": "/5BCyeLJHPcRwhu0YaRqUzw00JJ4.jpg",
      "overview": "A surveillance officer becomes absorbed in the lives of the artists he monitors.",
      "genres": ["Drama", "Thriller"],
      "voteAverage": 8.0,
      "popularity": 31.5,
      "predictedRating": 9,
      "rationale": "The moral transformation is gradual and performance-led, with the emotional precision your reviews consistently reward.",
      "source": "ai",
      "generatedAt": "2026-07-20T17:45:00Z",
      "provider": "openai-compatible",
      "model": "demo-model"
    }
  ]
}
